
Scratch directory: /tmp/
   => Libint2 <=

    Primary   basis highest AM E, G, H:  6, 6, 3
    Auxiliary basis highest AM E, G, H:  7, 7, 4
    Onebody   basis highest AM E, G, H:  -, -, -
    Solid Harmonics ordering:            Gaussian

*** tstart() called on gm-mpc
*** at Sat Nov 15 17:25:43 2025

   => Loading Basis Set <=

    Name: 6-31G*
    Role: ORBITAL
    Keyword: BASIS
    atoms 1   entry O          line   145 file /home/gia/anaconda3/envs/psi4/share/psi4/basis/6-31gs.gbs 
    atoms 2-3 entry H          line    44 file /home/gia/anaconda3/envs/psi4/share/psi4/basis/6-31gs.gbs 


         ---------------------------------------------------------
                                   SCF
               by Justin Turney, Rob Parrish, Andy Simmonett
                          and Daniel G. A. Smith
                              RKS Reference
                        4 Threads,    500 MiB Core
         ---------------------------------------------------------

  ==> Geometry <==

    Molecular point group: c2v
    Full point group: C2v

    Geometry (in Angstrom), charge = 0, multiplicity = 1:

       Center              X                  Y                   Z               Mass       
    ------------   -----------------  -----------------  -----------------  -----------------
         O            0.000000000000     0.000000000000    -0.078340411302    15.994914619570
         H            0.700000000000     0.000000000000     0.621659588698     1.007825032230
         H           -0.700000000000    -0.000000000000     0.621659588698     1.007825032230

  Running in c2v symmetry.

  Rotational constants: A =     19.21900  B =     17.06810  C =      9.03990 [cm^-1]
  Rotational constants: A = 576170.98718  B = 511688.88416  C = 271009.43539 [MHz]
  Nuclear repulsion =    8.930779015944612

  Charge       = 0
  Multiplicity = 1
  Electrons    = 10
  Nalpha       = 5
  Nbeta        = 5

  ==> Algorithm <==

  SCF Algorithm Type is DF.
  DIIS enabled.
  MOM disabled.
  Fractional occupation disabled.
  Guess Type is SAD.
  Energy threshold   = 1.00e-06
  Density threshold  = 1.00e-06
  Integral threshold = 1.00e-12

  ==> Primary Basis <==

  Basis Set: 6-31G*
    Blend: 6-31G*
    Number of shells: 10
    Number of basis functions: 19
    Number of Cartesian functions: 19
    Spherical Harmonics?: false
    Max angular momentum: 2

  ==> DFT Potential <==

   => LibXC <=

    Version 7.0.0
    S. Lehtola, C. Steigemann, M. J.T. Oliveira, and M. A.L. Marques.,  SoftwareX 7, 1–5 (2018) (10.1016/j.softx.2017.11.002)

   => Composite Functional: M06-2X <= 

    Hybrid M06-2X Meta-GGA XC Functional  (10.1007/s00214-007-0310-x)
    Y. Zhao and D. G. Truhlar,  Theor. Chem. Acc., 120, 215, 2008


    Deriv               =              1
    GGA                 =           TRUE
    Meta                =           TRUE

    Exchange Hybrid     =           TRUE
    MP2 Hybrid          =          FALSE

   => Exchange Functionals <=

    1.0000   XC_HYB_MGGA_X_M06_2X

   => Exact (HF) Exchange <=

    0.5400               HF 

   => Correlation Functionals <=

    1.0000   XC_MGGA_C_M06_2X

   => LibXC Density Thresholds  <==

    XC_MGGA_C_M06_2X:  1.00E-12 
    XC_HYB_MGGA_X_M06_2X:  1.00E-15 

   => Molecular Quadrature <=

    Radial Scheme          =       TREUTLER
    Pruning Scheme         =           NONE
    Nuclear Scheme         =       TREUTLER

    Blocking Scheme        =         OCTREE
    BS radius alpha        =              1
    Pruning alpha          =              1
    Radial Points          =             75
    Spherical Points       =            302
    Total Points           =          66009
    Total Blocks           =            556
    Max Points             =            255
    Max Functions          =             19
    Weights Tolerance      =       1.00E-15

   => Loading Basis Set <=

    Name: (6-31G* AUX)
    Role: JKFIT
    Keyword: DF_BASIS_SCF
    atoms 1   entry O          line   221 file /home/gia/anaconda3/envs/psi4/share/psi4/basis/cc-pvdz-jkfit.gbs 
    atoms 2-3 entry H          line    51 file /home/gia/anaconda3/envs/psi4/share/psi4/basis/cc-pvdz-jkfit.gbs 

  ==> Integral Setup <==

  DFHelper Memory: AOs need 0.001 GiB; user supplied 0.276 GiB. 
  SCF_SUBTYPE=INCORE selected. In-core MEM_DF algorithm will be used.
  Using in-core AOs.

  ==> MemDFJK: Density-Fitted J/K Matrices <==

    J tasked:                   Yes
    K tasked:                   Yes
    wK tasked:                   No
    OpenMP threads:               4
    Memory [MiB]:               282
    Algorithm:                 Core
    Schwarz Cutoff:           1E-12
    Mask sparsity (%):       0.0000
    Fitting Condition:        1E-10

   => Auxiliary Basis Set <=

  Basis Set: (6-31G* AUX)
    Blend: CC-PVDZ-JKFIT
    Number of shells: 42
    Number of basis functions: 131
    Number of Cartesian functions: 131
    Spherical Harmonics?: false
    Max angular momentum: 3

  Cached 100.0% of DFT collocation blocks in 0.090 [GiB].

  Minimum eigenvalue in the overlap matrix is 2.2795317620E-02.
  Reciprocal condition number of the overlap matrix is 5.4093126343E-03.
    Using symmetric orthogonalization.

  ==> Pre-Iterations <==

  SCF Guess: Superposition of Atomic Densities via on-the-fly atomic UHF (no occupation information).

   -------------------------
    Irrep   Nso     Nmo    
   -------------------------
     A1        10      10 
     A2         1       1 
     B1         5       5 
     B2         3       3 
   -------------------------
    Total      19      19
   -------------------------

  ==> Iterations <==

                           Total Energy        Delta E     RMS |[F,P]|

   @DF-RKS iter SAD:   -76.68903537326015   -7.66890e+01   0.00000e+00 
   @DF-RKS iter   1:   -76.28298157871480    4.06054e-01   3.68279e-02 DIIS/ADIIS
   @DF-RKS iter   2:   -76.32857587966411   -4.55943e-02   2.91606e-02 DIIS/ADIIS
   @DF-RKS iter   3:   -76.36334983285977   -3.47740e-02   8.98587e-03 DIIS/ADIIS
   @DF-RKS iter   4:   -76.36710152606761   -3.75169e-03   1.52905e-03 DIIS/ADIIS
   @DF-RKS iter   5:   -76.36721421923677   -1.12693e-04   5.92908e-05 DIIS
   @DF-RKS iter   6:   -76.36721439463695   -1.75400e-07   4.80440e-06 DIIS
   @DF-RKS iter   7:   -76.36721439627503   -1.63809e-09   2.17531e-07 DIIS
  Energy and wave function converged.


  ==> Post-Iterations <==

   Electrons on quadrature grid:
      Ntotal   =   10.0000001364 ; deviation = 1.364e-07 

    Orbital Energies [Eh]
    ---------------------

    Doubly Occupied:                                                      

       1A1   -19.636761     2A1    -1.117827     1B1    -0.555927  
       3A1    -0.478632     1B2    -0.379039  

    Virtual:                                                              

       4A1     0.105922     2B1     0.191533     3B1     0.789883  
       5A1     0.946760     6A1     0.967531     2B2     0.970166  
       4B1     1.132288     7A1     1.295536     8A1     1.763709  
       1A2     1.822001     3B2     1.826899     9A1     2.349656  
       5B1     2.544687    10A1     3.547157  

    Final Occupation by Irrep:
             A1    A2    B1    B2 
    DOCC [     3,    0,    1,    1 ]
    NA   [     3,    0,    1,    1 ]
    NB   [     3,    0,    1,    1 ]

  @DF-RKS Final Energy:   -76.36721439627503

   => Energetics <=

    Nuclear Repulsion Energy =              8.9307790159446121
    One-Electron Energy =                -122.5569065140593068
    Two-Electron Energy =                  41.7274656869735807
    DFT Exchange-Correlation Energy =      -4.4685525851339261
    Empirical Dispersion Energy =           0.0000000000000000
    VV10 Nonlocal Energy =                  0.0000000000000000
    Total Energy =                        -76.3672143962750454

Computation Completed


Properties will be evaluated at   0.000000,   0.000000,   0.000000 [a0]

Properties computed using the SCF density matrix


 Multipole Moments:

 ------------------------------------------------------------------------------------
     Multipole            Electronic (a.u.)      Nuclear  (a.u.)        Total (a.u.)
 ------------------------------------------------------------------------------------

 L = 1.  Multiply by 2.5417464519 to convert [e a0] to [Debye]
 Dipole X            :          0.0000000            0.0000000            0.0000000
 Dipole Y            :          0.0000000            0.0000000            0.0000000
 Dipole Z            :         -0.2295557            1.1651974            0.9356416
 Magnitude           :                                                    0.9356416

 ------------------------------------------------------------------------------------

*** tstop() called on gm-mpc at Sat Nov 15 17:25:44 2025
Module time:
	user time   =       2.32 seconds =       0.04 minutes
	system time =       0.06 seconds =       0.00 minutes
	total time  =          1 seconds =       0.02 minutes
Total time:
	user time   =      29.31 seconds =       0.49 minutes
	system time =       3.02 seconds =       0.05 minutes
	total time  =        595 seconds =       9.92 minutes
  Threads set to 4 by Python driver.

Scratch directory: /tmp/
   => Libint2 <=

    Primary   basis highest AM E, G, H:  6, 6, 3
    Auxiliary basis highest AM E, G, H:  7, 7, 4
    Onebody   basis highest AM E, G, H:  -, -, -
    Solid Harmonics ordering:            Gaussian

*** tstart() called on gm-mpc
*** at Sat Nov 15 17:26:20 2025

   => Loading Basis Set <=

    Name: 6-31G*
    Role: ORBITAL
    Keyword: BASIS
    atoms 1   entry O          line   145 file /home/gia/anaconda3/envs/psi4/share/psi4/basis/6-31gs.gbs 
    atoms 2-3 entry H          line    44 file /home/gia/anaconda3/envs/psi4/share/psi4/basis/6-31gs.gbs 


         ---------------------------------------------------------
                                   SCF
               by Justin Turney, Rob Parrish, Andy Simmonett
                          and Daniel G. A. Smith
                              RKS Reference
                        4 Threads,    500 MiB Core
         ---------------------------------------------------------

  ==> Geometry <==

    Molecular point group: c2v
    Full point group: C2v

    Geometry (in Angstrom), charge = 0, multiplicity = 1:

       Center              X                  Y                   Z               Mass       
    ------------   -----------------  -----------------  -----------------  -----------------
         O            0.000000000000     0.000000000000    -0.078340411302    15.994914619570
         H            0.700000000000     0.000000000000     0.621659588698     1.007825032230
         H           -0.700000000000    -0.000000000000     0.621659588698     1.007825032230

  Running in c2v symmetry.

  Rotational constants: A =     19.21900  B =     17.06810  C =      9.03990 [cm^-1]
  Rotational constants: A = 576170.98718  B = 511688.88416  C = 271009.43539 [MHz]
  Nuclear repulsion =    8.930779015944612

  Charge       = 0
  Multiplicity = 1
  Electrons    = 10
  Nalpha       = 5
  Nbeta        = 5

  ==> Algorithm <==

  SCF Algorithm Type is DF.
  DIIS enabled.
  MOM disabled.
  Fractional occupation disabled.
  Guess Type is SAD.
  Energy threshold   = 1.00e-06
  Density threshold  = 1.00e-06
  Integral threshold = 1.00e-12

  ==> Primary Basis <==

  Basis Set: 6-31G*
    Blend: 6-31G*
    Number of shells: 10
    Number of basis functions: 19
    Number of Cartesian functions: 19
    Spherical Harmonics?: false
    Max angular momentum: 2

  ==> DFT Potential <==

   => LibXC <=

    Version 7.0.0
    S. Lehtola, C. Steigemann, M. J.T. Oliveira, and M. A.L. Marques.,  SoftwareX 7, 1–5 (2018) (10.1016/j.softx.2017.11.002)

   => Composite Functional: M06-2X <= 

    Hybrid M06-2X Meta-GGA XC Functional  (10.1007/s00214-007-0310-x)
    Y. Zhao and D. G. Truhlar,  Theor. Chem. Acc., 120, 215, 2008


    Deriv               =              1
    GGA                 =           TRUE
    Meta                =           TRUE

    Exchange Hybrid     =           TRUE
    MP2 Hybrid          =          FALSE

   => Exchange Functionals <=

    1.0000   XC_HYB_MGGA_X_M06_2X

   => Exact (HF) Exchange <=

    0.5400               HF 

   => Correlation Functionals <=

    1.0000   XC_MGGA_C_M06_2X

   => LibXC Density Thresholds  <==

    XC_MGGA_C_M06_2X:  1.00E-12 
    XC_HYB_MGGA_X_M06_2X:  1.00E-15 

   => Molecular Quadrature <=

    Radial Scheme          =       TREUTLER
    Pruning Scheme         =           NONE
    Nuclear Scheme         =       TREUTLER

    Blocking Scheme        =         OCTREE
    BS radius alpha        =              1
    Pruning alpha          =              1
    Radial Points          =             75
    Spherical Points       =            302
    Total Points           =          66009
    Total Blocks           =            556
    Max Points             =            255
    Max Functions          =             19
    Weights Tolerance      =       1.00E-15

   => Loading Basis Set <=

    Name: (6-31G* AUX)
    Role: JKFIT
    Keyword: DF_BASIS_SCF
    atoms 1   entry O          line   221 file /home/gia/anaconda3/envs/psi4/share/psi4/basis/cc-pvdz-jkfit.gbs 
    atoms 2-3 entry H          line    51 file /home/gia/anaconda3/envs/psi4/share/psi4/basis/cc-pvdz-jkfit.gbs 

  ==> Integral Setup <==

  DFHelper Memory: AOs need 0.001 GiB; user supplied 0.276 GiB. 
  SCF_SUBTYPE=INCORE selected. In-core MEM_DF algorithm will be used.
  Using in-core AOs.

  ==> MemDFJK: Density-Fitted J/K Matrices <==

    J tasked:                   Yes
    K tasked:                   Yes
    wK tasked:                   No
    OpenMP threads:               4
    Memory [MiB]:               282
    Algorithm:                 Core
    Schwarz Cutoff:           1E-12
    Mask sparsity (%):       0.0000
    Fitting Condition:        1E-10

   => Auxiliary Basis Set <=

  Basis Set: (6-31G* AUX)
    Blend: CC-PVDZ-JKFIT
    Number of shells: 42
    Number of basis functions: 131
    Number of Cartesian functions: 131
    Spherical Harmonics?: false
    Max angular momentum: 3

  Cached 100.0% of DFT collocation blocks in 0.090 [GiB].

  Minimum eigenvalue in the overlap matrix is 2.2795317620E-02.
  Reciprocal condition number of the overlap matrix is 5.4093126343E-03.
    Using symmetric orthogonalization.

  ==> Pre-Iterations <==

  SCF Guess: Superposition of Atomic Densities via on-the-fly atomic UHF (no occupation information).

   -------------------------
    Irrep   Nso     Nmo    
   -------------------------
     A1        10      10 
     A2         1       1 
     B1         5       5 
     B2         3       3 
   -------------------------
    Total      19      19
   -------------------------

  ==> Iterations <==

                           Total Energy        Delta E     RMS |[F,P]|

   @DF-RKS iter SAD:   -76.68903537326013   -7.66890e+01   0.00000e+00 
   @DF-RKS iter   1:   -76.28298157871478    4.06054e-01   3.68279e-02 DIIS/ADIIS
   @DF-RKS iter   2:   -76.32857587966414   -4.55943e-02   2.91606e-02 DIIS/ADIIS
   @DF-RKS iter   3:   -76.36334983285968   -3.47740e-02   8.98587e-03 DIIS/ADIIS
   @DF-RKS iter   4:   -76.36710152606756   -3.75169e-03   1.52905e-03 DIIS/ADIIS
   @DF-RKS iter   5:   -76.36721421923679   -1.12693e-04   5.92908e-05 DIIS
   @DF-RKS iter   6:   -76.36721439463702   -1.75400e-07   4.80440e-06 DIIS
   @DF-RKS iter   7:   -76.36721439627507   -1.63806e-09   2.17531e-07 DIIS
  Energy and wave function converged.


  ==> Post-Iterations <==

   Electrons on quadrature grid:
      Ntotal   =   10.0000001364 ; deviation = 1.364e-07 

    Orbital Energies [Eh]
    ---------------------

    Doubly Occupied:                                                      

       1A1   -19.636761     2A1    -1.117827     1B1    -0.555927  
       3A1    -0.478632     1B2    -0.379039  

    Virtual:                                                              

       4A1     0.105922     2B1     0.191533     3B1     0.789883  
       5A1     0.946760     6A1     0.967531     2B2     0.970166  
       4B1     1.132288     7A1     1.295536     8A1     1.763709  
       1A2     1.822001     3B2     1.826899     9A1     2.349656  
       5B1     2.544687    10A1     3.547157  

    Final Occupation by Irrep:
             A1    A2    B1    B2 
    DOCC [     3,    0,    1,    1 ]
    NA   [     3,    0,    1,    1 ]
    NB   [     3,    0,    1,    1 ]

  @DF-RKS Final Energy:   -76.36721439627507

   => Energetics <=

    Nuclear Repulsion Energy =              8.9307790159446121
    One-Electron Energy =                -122.5569065140593636
    Two-Electron Energy =                  41.7274656869735949
    DFT Exchange-Correlation Energy =      -4.4685525851339261
    Empirical Dispersion Energy =           0.0000000000000000
    VV10 Nonlocal Energy =                  0.0000000000000000
    Total Energy =                        -76.3672143962750738

Computation Completed


Properties will be evaluated at   0.000000,   0.000000,   0.000000 [a0]

Properties computed using the SCF density matrix


 Multipole Moments:

 ------------------------------------------------------------------------------------
     Multipole            Electronic (a.u.)      Nuclear  (a.u.)        Total (a.u.)
 ------------------------------------------------------------------------------------

 L = 1.  Multiply by 2.5417464519 to convert [e a0] to [Debye]
 Dipole X            :          0.0000000            0.0000000            0.0000000
 Dipole Y            :          0.0000000            0.0000000            0.0000000
 Dipole Z            :         -0.2295557            1.1651974            0.9356416
 Magnitude           :                                                    0.9356416

 ------------------------------------------------------------------------------------

*** tstop() called on gm-mpc at Sat Nov 15 17:26:20 2025
Module time:
	user time   =       2.31 seconds =       0.04 minutes
	system time =       0.09 seconds =       0.00 minutes
	total time  =          0 seconds =       0.00 minutes
Total time:
	user time   =      32.27 seconds =       0.54 minutes
	system time =       3.16 seconds =       0.05 minutes
	total time  =        631 seconds =      10.52 minutes


Properties will be evaluated at   0.000000,   0.000000,   0.000000 [a0]


Properties will be evaluated at   0.000000,   0.000000,   0.000000 [a0]
  Threads set to 4 by Python driver.

Scratch directory: /tmp/
   => Libint2 <=

    Primary   basis highest AM E, G, H:  6, 6, 3
    Auxiliary basis highest AM E, G, H:  7, 7, 4
    Onebody   basis highest AM E, G, H:  -, -, -
    Solid Harmonics ordering:            Gaussian

*** tstart() called on gm-mpc
*** at Sat Nov 15 17:27:01 2025

   => Loading Basis Set <=

    Name: 6-31G*
    Role: ORBITAL
    Keyword: BASIS
    atoms 1   entry O          line   145 file /home/gia/anaconda3/envs/psi4/share/psi4/basis/6-31gs.gbs 
    atoms 2-3 entry H          line    44 file /home/gia/anaconda3/envs/psi4/share/psi4/basis/6-31gs.gbs 


         ---------------------------------------------------------
                                   SCF
               by Justin Turney, Rob Parrish, Andy Simmonett
                          and Daniel G. A. Smith
                              RKS Reference
                        4 Threads,    500 MiB Core
         ---------------------------------------------------------

  ==> Geometry <==

    Molecular point group: c2v
    Full point group: C2v

    Geometry (in Angstrom), charge = 0, multiplicity = 1:

       Center              X                  Y                   Z               Mass       
    ------------   -----------------  -----------------  -----------------  -----------------
         O            0.000000000000     0.000000000000    -0.078340411302    15.994914619570
         H            0.700000000000     0.000000000000     0.621659588698     1.007825032230
         H           -0.700000000000    -0.000000000000     0.621659588698     1.007825032230

  Running in c2v symmetry.

  Rotational constants: A =     19.21900  B =     17.06810  C =      9.03990 [cm^-1]
  Rotational constants: A = 576170.98718  B = 511688.88416  C = 271009.43539 [MHz]
  Nuclear repulsion =    8.930779015944612

  Charge       = 0
  Multiplicity = 1
  Electrons    = 10
  Nalpha       = 5
  Nbeta        = 5

  ==> Algorithm <==

  SCF Algorithm Type is DF.
  DIIS enabled.
  MOM disabled.
  Fractional occupation disabled.
  Guess Type is SAD.
  Energy threshold   = 1.00e-06
  Density threshold  = 1.00e-06
  Integral threshold = 1.00e-12

  ==> Primary Basis <==

  Basis Set: 6-31G*
    Blend: 6-31G*
    Number of shells: 10
    Number of basis functions: 19
    Number of Cartesian functions: 19
    Spherical Harmonics?: false
    Max angular momentum: 2

  ==> DFT Potential <==

   => LibXC <=

    Version 7.0.0
    S. Lehtola, C. Steigemann, M. J.T. Oliveira, and M. A.L. Marques.,  SoftwareX 7, 1–5 (2018) (10.1016/j.softx.2017.11.002)

   => Composite Functional: M06-2X <= 

    Hybrid M06-2X Meta-GGA XC Functional  (10.1007/s00214-007-0310-x)
    Y. Zhao and D. G. Truhlar,  Theor. Chem. Acc., 120, 215, 2008


    Deriv               =              1
    GGA                 =           TRUE
    Meta                =           TRUE

    Exchange Hybrid     =           TRUE
    MP2 Hybrid          =          FALSE

   => Exchange Functionals <=

    1.0000   XC_HYB_MGGA_X_M06_2X

   => Exact (HF) Exchange <=

    0.5400               HF 

   => Correlation Functionals <=

    1.0000   XC_MGGA_C_M06_2X

   => LibXC Density Thresholds  <==

    XC_MGGA_C_M06_2X:  1.00E-12 
    XC_HYB_MGGA_X_M06_2X:  1.00E-15 

   => Molecular Quadrature <=

    Radial Scheme          =       TREUTLER
    Pruning Scheme         =           NONE
    Nuclear Scheme         =       TREUTLER

    Blocking Scheme        =         OCTREE
    BS radius alpha        =              1
    Pruning alpha          =              1
    Radial Points          =             75
    Spherical Points       =            302
    Total Points           =          66009
    Total Blocks           =            556
    Max Points             =            255
    Max Functions          =             19
    Weights Tolerance      =       1.00E-15

   => Loading Basis Set <=

    Name: (6-31G* AUX)
    Role: JKFIT
    Keyword: DF_BASIS_SCF
    atoms 1   entry O          line   221 file /home/gia/anaconda3/envs/psi4/share/psi4/basis/cc-pvdz-jkfit.gbs 
    atoms 2-3 entry H          line    51 file /home/gia/anaconda3/envs/psi4/share/psi4/basis/cc-pvdz-jkfit.gbs 

  ==> Integral Setup <==

  DFHelper Memory: AOs need 0.001 GiB; user supplied 0.276 GiB. 
  SCF_SUBTYPE=INCORE selected. In-core MEM_DF algorithm will be used.
  Using in-core AOs.

  ==> MemDFJK: Density-Fitted J/K Matrices <==

    J tasked:                   Yes
    K tasked:                   Yes
    wK tasked:                   No
    OpenMP threads:               4
    Memory [MiB]:               282
    Algorithm:                 Core
    Schwarz Cutoff:           1E-12
    Mask sparsity (%):       0.0000
    Fitting Condition:        1E-10

   => Auxiliary Basis Set <=

  Basis Set: (6-31G* AUX)
    Blend: CC-PVDZ-JKFIT
    Number of shells: 42
    Number of basis functions: 131
    Number of Cartesian functions: 131
    Spherical Harmonics?: false
    Max angular momentum: 3

  Cached 100.0% of DFT collocation blocks in 0.090 [GiB].

  Minimum eigenvalue in the overlap matrix is 2.2795317620E-02.
  Reciprocal condition number of the overlap matrix is 5.4093126343E-03.
    Using symmetric orthogonalization.

  ==> Pre-Iterations <==

  SCF Guess: Superposition of Atomic Densities via on-the-fly atomic UHF (no occupation information).

   -------------------------
    Irrep   Nso     Nmo    
   -------------------------
     A1        10      10 
     A2         1       1 
     B1         5       5 
     B2         3       3 
   -------------------------
    Total      19      19
   -------------------------

  ==> Iterations <==

                           Total Energy        Delta E     RMS |[F,P]|

   @DF-RKS iter SAD:   -76.68903537326014   -7.66890e+01   0.00000e+00 
   @DF-RKS iter   1:   -76.28298157871478    4.06054e-01   3.68279e-02 DIIS/ADIIS
   @DF-RKS iter   2:   -76.32857587966407   -4.55943e-02   2.91606e-02 DIIS/ADIIS
   @DF-RKS iter   3:   -76.36334983285971   -3.47740e-02   8.98587e-03 DIIS/ADIIS
   @DF-RKS iter   4:   -76.36710152606754   -3.75169e-03   1.52905e-03 DIIS/ADIIS
   @DF-RKS iter   5:   -76.36721421923681   -1.12693e-04   5.92908e-05 DIIS
   @DF-RKS iter   6:   -76.36721439463702   -1.75400e-07   4.80440e-06 DIIS
   @DF-RKS iter   7:   -76.36721439627506   -1.63804e-09   2.17531e-07 DIIS
  Energy and wave function converged.


  ==> Post-Iterations <==

   Electrons on quadrature grid:
      Ntotal   =   10.0000001364 ; deviation = 1.364e-07 

    Orbital Energies [Eh]
    ---------------------

    Doubly Occupied:                                                      

       1A1   -19.636761     2A1    -1.117827     1B1    -0.555927  
       3A1    -0.478632     1B2    -0.379039  

    Virtual:                                                              

       4A1     0.105922     2B1     0.191533     3B1     0.789883  
       5A1     0.946760     6A1     0.967531     2B2     0.970166  
       4B1     1.132288     7A1     1.295536     8A1     1.763709  
       1A2     1.822001     3B2     1.826899     9A1     2.349656  
       5B1     2.544687    10A1     3.547157  

    Final Occupation by Irrep:
             A1    A2    B1    B2 
    DOCC [     3,    0,    1,    1 ]
    NA   [     3,    0,    1,    1 ]
    NB   [     3,    0,    1,    1 ]

  @DF-RKS Final Energy:   -76.36721439627506

   => Energetics <=

    Nuclear Repulsion Energy =              8.9307790159446121
    One-Electron Energy =                -122.5569065140592784
    Two-Electron Energy =                  41.7274656869735310
    DFT Exchange-Correlation Energy =      -4.4685525851339225
    Empirical Dispersion Energy =           0.0000000000000000
    VV10 Nonlocal Energy =                  0.0000000000000000
    Total Energy =                        -76.3672143962750596

Computation Completed


Properties will be evaluated at   0.000000,   0.000000,   0.000000 [a0]

Properties computed using the SCF density matrix


 Multipole Moments:

 ------------------------------------------------------------------------------------
     Multipole            Electronic (a.u.)      Nuclear  (a.u.)        Total (a.u.)
 ------------------------------------------------------------------------------------

 L = 1.  Multiply by 2.5417464519 to convert [e a0] to [Debye]
 Dipole X            :          0.0000000            0.0000000            0.0000000
 Dipole Y            :          0.0000000            0.0000000            0.0000000
 Dipole Z            :         -0.2295557            1.1651974            0.9356416
 Magnitude           :                                                    0.9356416

 ------------------------------------------------------------------------------------

*** tstop() called on gm-mpc at Sat Nov 15 17:27:02 2025
Module time:
	user time   =       2.74 seconds =       0.05 minutes
	system time =       0.11 seconds =       0.00 minutes
	total time  =          1 seconds =       0.02 minutes
Total time:
	user time   =      35.63 seconds =       0.59 minutes
	system time =       3.31 seconds =       0.06 minutes
	total time  =        673 seconds =      11.22 minutes

*** tstart() called on gm-mpc
*** at Sat Nov 15 17:27:02 2025

   => Libint2 <=

    Primary   basis highest AM E, G, H:  6, 6, 3
    Auxiliary basis highest AM E, G, H:  7, 7, 4
    Onebody   basis highest AM E, G, H:  -, -, -
    Solid Harmonics ordering:            Gaussian
   => Loading Basis Set <=

    Name: 6-31G*
    Role: ORBITAL
    Keyword: BASIS
    atoms 1   entry O          line   145 file /home/gia/anaconda3/envs/psi4/share/psi4/basis/6-31gs.gbs 
    atoms 2-3 entry H          line    44 file /home/gia/anaconda3/envs/psi4/share/psi4/basis/6-31gs.gbs 


         ---------------------------------------------------------
                                   SCF
               by Justin Turney, Rob Parrish, Andy Simmonett
                          and Daniel G. A. Smith
                              RKS Reference
                        4 Threads,    500 MiB Core
         ---------------------------------------------------------

  ==> Geometry <==

    Molecular point group: c2v
    Full point group: C2v

    Geometry (in Angstrom), charge = 0, multiplicity = 1:

       Center              X                  Y                   Z               Mass       
    ------------   -----------------  -----------------  -----------------  -----------------
         O            0.000000000000     0.000000000000    -0.078340411302    15.994914619570
         H            0.700000000000     0.000000000000     0.621659588698     1.007825032230
         H           -0.700000000000    -0.000000000000     0.621659588698     1.007825032230

  Running in c2v symmetry.

  Rotational constants: A =     19.21900  B =     17.06810  C =      9.03990 [cm^-1]
  Rotational constants: A = 576170.98718  B = 511688.88416  C = 271009.43539 [MHz]
  Nuclear repulsion =    8.930779015944612

  Charge       = 0
  Multiplicity = 1
  Electrons    = 10
  Nalpha       = 5
  Nbeta        = 5

  ==> Algorithm <==

  SCF Algorithm Type is DF.
  DIIS enabled.
  MOM disabled.
  Fractional occupation disabled.
  Guess Type is SAD.
  Energy threshold   = 1.00e-06
  Density threshold  = 1.00e-06
  Integral threshold = 1.00e-12

  ==> Primary Basis <==

  Basis Set: 6-31G*
    Blend: 6-31G*
    Number of shells: 10
    Number of basis functions: 19
    Number of Cartesian functions: 19
    Spherical Harmonics?: false
    Max angular momentum: 2

  ==> DFT Potential <==

   => LibXC <=

    Version 7.0.0
    S. Lehtola, C. Steigemann, M. J.T. Oliveira, and M. A.L. Marques.,  SoftwareX 7, 1–5 (2018) (10.1016/j.softx.2017.11.002)

   => Composite Functional: M06-2X <= 

    Hybrid M06-2X Meta-GGA XC Functional  (10.1007/s00214-007-0310-x)
    Y. Zhao and D. G. Truhlar,  Theor. Chem. Acc., 120, 215, 2008


    Deriv               =              1
    GGA                 =           TRUE
    Meta                =           TRUE

    Exchange Hybrid     =           TRUE
    MP2 Hybrid          =          FALSE

   => Exchange Functionals <=

    1.0000   XC_HYB_MGGA_X_M06_2X

   => Exact (HF) Exchange <=

    0.5400               HF 

   => Correlation Functionals <=

    1.0000   XC_MGGA_C_M06_2X

   => LibXC Density Thresholds  <==

    XC_MGGA_C_M06_2X:  1.00E-12 
    XC_HYB_MGGA_X_M06_2X:  1.00E-15 

   => Molecular Quadrature <=

    Radial Scheme          =       TREUTLER
    Pruning Scheme         =           NONE
    Nuclear Scheme         =       TREUTLER

    Blocking Scheme        =         OCTREE
    BS radius alpha        =              1
    Pruning alpha          =              1
    Radial Points          =             75
    Spherical Points       =            302
    Total Points           =          66009
    Total Blocks           =            556
    Max Points             =            255
    Max Functions          =             19
    Weights Tolerance      =       1.00E-15

   => Loading Basis Set <=

    Name: (6-31G* AUX)
    Role: JKFIT
    Keyword: DF_BASIS_SCF
    atoms 1   entry O          line   221 file /home/gia/anaconda3/envs/psi4/share/psi4/basis/cc-pvdz-jkfit.gbs 
    atoms 2-3 entry H          line    51 file /home/gia/anaconda3/envs/psi4/share/psi4/basis/cc-pvdz-jkfit.gbs 

  ==> Integral Setup <==

  DFHelper Memory: AOs need 0.001 GiB; user supplied 0.276 GiB. 
  SCF_SUBTYPE=INCORE selected. In-core MEM_DF algorithm will be used.
  Using in-core AOs.

  ==> MemDFJK: Density-Fitted J/K Matrices <==

    J tasked:                   Yes
    K tasked:                   Yes
    wK tasked:                   No
    OpenMP threads:               4
    Memory [MiB]:               282
    Algorithm:                 Core
    Schwarz Cutoff:           1E-12
    Mask sparsity (%):       0.0000
    Fitting Condition:        1E-10

   => Auxiliary Basis Set <=

  Basis Set: (6-31G* AUX)
    Blend: CC-PVDZ-JKFIT
    Number of shells: 42
    Number of basis functions: 131
    Number of Cartesian functions: 131
    Spherical Harmonics?: false
    Max angular momentum: 3

  Cached 100.0% of DFT collocation blocks in 0.090 [GiB].

  Minimum eigenvalue in the overlap matrix is 2.2795317620E-02.
  Reciprocal condition number of the overlap matrix is 5.4093126343E-03.
    Using symmetric orthogonalization.

  ==> Pre-Iterations <==

  SCF Guess: Superposition of Atomic Densities via on-the-fly atomic UHF (no occupation information).

   -------------------------
    Irrep   Nso     Nmo    
   -------------------------
     A1        10      10 
     A2         1       1 
     B1         5       5 
     B2         3       3 
   -------------------------
    Total      19      19
   -------------------------

  ==> Iterations <==

                           Total Energy        Delta E     RMS |[F,P]|

   @DF-RKS iter SAD:   -76.68903537326013   -7.66890e+01   0.00000e+00 
   @DF-RKS iter   1:   -76.28298157871474    4.06054e-01   3.68279e-02 DIIS/ADIIS
   @DF-RKS iter   2:   -76.32857587966413   -4.55943e-02   2.91606e-02 DIIS/ADIIS
   @DF-RKS iter   3:   -76.36334983285970   -3.47740e-02   8.98587e-03 DIIS/ADIIS
   @DF-RKS iter   4:   -76.36710152606761   -3.75169e-03   1.52905e-03 DIIS/ADIIS
   @DF-RKS iter   5:   -76.36721421923679   -1.12693e-04   5.92908e-05 DIIS
   @DF-RKS iter   6:   -76.36721439463696   -1.75400e-07   4.80440e-06 DIIS
   @DF-RKS iter   7:   -76.36721439627506   -1.63810e-09   2.17531e-07 DIIS
  Energy and wave function converged.


  ==> Post-Iterations <==

   Electrons on quadrature grid:
      Ntotal   =   10.0000001364 ; deviation = 1.364e-07 

    Orbital Energies [Eh]
    ---------------------

    Doubly Occupied:                                                      

       1A1   -19.636761     2A1    -1.117827     1B1    -0.555927  
       3A1    -0.478632     1B2    -0.379039  

    Virtual:                                                              

       4A1     0.105922     2B1     0.191533     3B1     0.789883  
       5A1     0.946760     6A1     0.967531     2B2     0.970166  
       4B1     1.132288     7A1     1.295536     8A1     1.763709  
       1A2     1.822001     3B2     1.826899     9A1     2.349656  
       5B1     2.544687    10A1     3.547157  

    Final Occupation by Irrep:
             A1    A2    B1    B2 
    DOCC [     3,    0,    1,    1 ]
    NA   [     3,    0,    1,    1 ]
    NB   [     3,    0,    1,    1 ]

  @DF-RKS Final Energy:   -76.36721439627506

   => Energetics <=

    Nuclear Repulsion Energy =              8.9307790159446121
    One-Electron Energy =                -122.5569065140593210
    Two-Electron Energy =                  41.7274656869735665
    DFT Exchange-Correlation Energy =      -4.4685525851339243
    Empirical Dispersion Energy =           0.0000000000000000
    VV10 Nonlocal Energy =                  0.0000000000000000
    Total Energy =                        -76.3672143962750738

Computation Completed


Properties will be evaluated at   0.000000,   0.000000,   0.000000 [a0]

Properties computed using the M06-2X density matrix


 Multipole Moments:

 ------------------------------------------------------------------------------------
     Multipole            Electronic (a.u.)      Nuclear  (a.u.)        Total (a.u.)
 ------------------------------------------------------------------------------------

 L = 1.  Multiply by 2.5417464519 to convert [e a0] to [Debye]
 Dipole X            :          0.0000000            0.0000000            0.0000000
 Dipole Y            :          0.0000000            0.0000000            0.0000000
 Dipole Z            :         -0.2295557            1.1651974            0.9356416
 Magnitude           :                                                    0.9356416

 ------------------------------------------------------------------------------------

*** tstop() called on gm-mpc at Sat Nov 15 17:27:03 2025
Module time:
	user time   =       2.77 seconds =       0.05 minutes
	system time =       0.10 seconds =       0.00 minutes
	total time  =          1 seconds =       0.02 minutes
Total time:
	user time   =      38.55 seconds =       0.64 minutes
	system time =       3.41 seconds =       0.06 minutes
	total time  =        674 seconds =      11.23 minutes
